{
  "schema": "xcodebuildmcp.output.debug-stack-result",
  "schemaVersion": "1",
  "didError": false,
  "error": null,
  "data": {
    "threads": [
      {
        "threadId": 1,
        "name": "Thread 1",
        "truncated": false,
        "frames": [
          {
            "index": 0,
            "symbol": "mach_msg2_trap",
            "displayLocation": "/usr/lib/system/libsystem_kernel.dylib`mach_msg2_trap:<OFFSET>"
          },
          {
            "index": 1,
            "symbol": "mach_msg2_internal",
            "displayLocation": "/usr/lib/system/libsystem_kernel.dylib`mach_msg2_internal:<OFFSET>"
          },
          {
            "index": 2,
            "symbol": "mach_msg_overwrite",
            "displayLocation": "/usr/lib/system/libsystem_kernel.dylib`mach_msg_overwrite:<OFFSET>"
          },
          {
            "index": 3,
            "symbol": "mach_msg",
            "displayLocation": "/usr/lib/system/libsystem_kernel.dylib`mach_msg:<OFFSET>"
          },
          {
            "index": 4,
            "symbol": "<ADDR>",
            "displayLocation": "<ADDR>:1"
          },
          {
            "index": 5,
            "symbol": "<ADDR>",
            "displayLocation": "<ADDR>:1"
          },
          {
            "index": 6,
            "symbol": "<ADDR>",
            "displayLocation": "<ADDR>:1"
          },
          {
            "index": 7,
            "symbol": "<ADDR>",
            "displayLocation": "<ADDR>:1"
          },
          {
            "index": 8,
            "symbol": "<ADDR>",
            "displayLocation": "<ADDR>:1"
          },
          {
            "index": 9,
            "symbol": "<ADDR>",
            "displayLocation": "<ADDR>:1"
          },
          {
            "index": 10,
            "symbol": "<ADDR>",
            "displayLocation": "<ADDR>:1"
          },
          {
            "index": 11,
            "symbol": "<ADDR>",
            "displayLocation": "<ADDR>:1"
          },
          {
            "index": 12,
            "symbol": "<ADDR>",
            "displayLocation": "<ADDR>:1"
          },
          {
            "index": 13,
            "symbol": "static CalculatorApp.$main()",
            "displayLocation": "<HOME>/Library/Developer/CoreSimulator/Devices/<UUID>/data/Containers/Bundle/Application/<UUID>/CalculatorApp.app/CalculatorApp.debug.dylib`static CalculatorApp.CalculatorApp.$main() -> ():<OFFSET>"
          },
          {
            "index": 14,
            "symbol": "main",
            "displayLocation": "<HOME>/Library/Developer/CoreSimulator/Devices/<UUID>/data/Containers/Bundle/Application/<UUID>/CalculatorApp.app/CalculatorApp.debug.dylib`main:<OFFSET>"
          },
          {
            "index": 15,
            "symbol": "start_sim",
            "displayLocation": "/Library/Developer/CoreSimulator/Volumes/iOS_23E244/Library/Developer/CoreSimulator/Profiles/Runtimes/iOS 26.4.simruntime/Contents/Resources/RuntimeRoot/usr/lib/dyld_sim`start_sim:<OFFSET>"
          },
          {
            "index": 16,
            "symbol": "start",
            "displayLocation": "/usr/lib/dyld`start:<OFFSET>"
          }
        ]
      }
    ]
  }
}
